,Body,Date,Title,Author,profanityCount,isSatire,1984,1985,1986,1987,1988,1989,1990,1991,1992,1993,1994,1995,1996,1997,1998,1999,2000,2001,2002,2003,2004,2005,2006,2007,2008,2009,2010,2011,2012,2013,2014,2015,2016,2017,2018,titleWordCount,wordCount,titleAvgSyl,avgSyl,senCount,linkCount,twitChar,titleFR,FR,titleGF,GF,titleARI,ARI
0,"Do you still feel younger than you thought you would by now? Or darlin' have you started feeling old yet? Don't worry, I'm sure that you're still breaking hearts with the efficiency that only youth can harness. And do you still think that love is a laserquest? Or do you take it all more seriously? I've tried to ask you this in some daydreams that I've had but you're always busy being make-believe. And do you look into the mirror to remind yourself you're there, or has somebody's goodnight kisses got that covered? When I'm not being honest I pretend that you were just some lover. Now I can't think of there without thinking of you. I doubt that comes as a surprise. And I can't think of anything to dream about, I can't find anywhere to hide. When I'm hanging on by the rings around my eyes and I've convinced myself I need another for a minute it gets easier to pretend that you were just some lover. When I'm pipe and slippers and rocking chair singing dreadful songs about summat I have found a better method of pretending you were just some lover. Well, I have found a better method of pretending you were just some lover.",2011,Love Is A Laserquest,Arctic Monkeys,1,0,0,0,0,0,0,0,0,0,0,0,0,0,0,0,0,0,0,0,0,0,0,0,0,0,0,0,0,1,0,0,0,0,0,0,0,4,243,1.0740740740740742,1.0,14,0,0,118.18,90.19,3.6,12.744688995215311,0.6,6.9
1,"I'm comin' out of my cage and I've been doin' just fine. Gotta, gotta be down because I want it all. It started out with a kiss, how did it end up like this? It was only a kiss, it was only a kiss. Now I'm falling asleep and she's calling a cab while he's having a smoke and she's taking a drag. Now they're going to bed and my stomach is sick and it's all in my head but she's touching his chest now, she takes off her dress now. Let me go. And I just can't look, it's killing me and taking control. Jealousy, turning saints into the sea, swimming through sick lullabies, choking on your alibies, but it's just the price I pay. Destiny is calling me, open up my eager eyes 'cause I'm Mr. Brightside. I'm comin' out of my cage and I've been doin' just fine. Gotta, gotta be down because I want it all. It started out with a kiss, how did it end up like this? It was only a kiss, it was only a kiss. Now I'm falling asleep and she's calling a cab while he's having a smoke and she's taking a drag. Now they're going to bed and my stomach is sick and it's all in my head but she's touching his chest now, she takes off her dress now. Let me go. And I just can't look, it's killing me and taking control. Jealousy, turning saints into the sea, swimming through sick lullabies, choking on your alibies, but it's just the price I pay. Destiny is calling me, open up my eager eyes 'cause I'm Mr. Brightside. I never. I never. I never. I never.",2003,Mr. Brightside,The Killers,2,0,0,0,0,0,0,0,0,0,0,0,0,0,0,0,0,0,0,0,0,1,0,0,0,0,0,0,0,0,0,0,0,0,0,0,0,2,364,0.9505494505494505,1.5,24,0,0,77.91,90.8,22.8,9.817902097902099,10.2,4.7
2,"Girl afraid, where do his intentions lay? Or does he even have any? She said, 'He never really looks at me. I give him every opportunity. In the room downstairs he sat and stared, in the room downstairs he sat and stared. I'll never make that mistake again. I'll never make that mistake again.' Boy afraid, prudence never pays. And everything she wants costs money. 'But she doesn't even like me. And I know because she said so. In the room downstairs she sat and stared, in the room downstairs she sat and stared. I'll never make that mistake again, no.",1984,Girl Afraid,The Smiths,0,1,1,0,0,0,0,0,0,0,0,0,0,0,0,0,0,0,0,0,0,0,0,0,0,0,0,0,0,0,0,0,0,0,0,0,0,2,125,1.024,1.0,13,0,0,120.21,88.94,2.8000000000000003,6.704158415841585,3.1,3.6
3,"I got my stitches stitched, I got my fixes fixed, and in my aching head I got my kisses slit. Our gossip lips stuttered every word I said, I said. I got your love letters, corrected for grammar, and sent them back. It's true romance is dead, I shot it in the chest and in the head. And if you wanna go down in history, then I'm your prince because they've got me in a bad way. I've never seen a heart I couldn't break. It was never about the songs, it was competition. Make the biggest scene, make the biggest... Which came first, the music or the misery? We're high-fashion, we're last chances. Which came first, the music or the misery? We're high-fashion, we're last chances. I'm casually obsessed and I've forgiven death. I am indifferent yet I am a total wreck. I'm every cliché but I simply do it best. And if you wanna go down in history then I'm your prince because they've got me in a bad way. I've never seen a heart I couldn't break. It was never about the songs, it was competition. Make the biggest scene, make the biggest... Which came first, the music or the misery? We're high-fashion, we're last chances. Which came first, the music or the misery? We're high-fashion, we're last chances. Go! I went to sleep a poet and I woke up a fraud. To calm your nerves I'm feeling for my clothes in the dark. Which came first, the music or the misery? We're high-fashion, we're last chances. Which came first, the music or the misery? We're high-fashion, we're last chances.Which came first, the music or the misery? We're high-fashion, we're last chances.",2005,The Music Or the Misery,Fall Out Boy,0,0,0,0,0,0,0,0,0,0,0,0,0,0,0,0,0,0,0,0,0,0,0,1,0,0,0,0,0,0,0,0,0,0,0,0,0,5,370,0.9783783783783784,1.4,31,0,0,83.32,87.52,20.0,9.04842105263158,-1.1,4.3
4,"If you could only see the beast you've made of me. I held it in but now it seems you've set it running free. Screaming in the dark, I howl when we're apart. Drag my teeth across your chest to taste your beating heart, my fingers claw your skin, try to tear my way in. You are the moon that breaks the night for which I have to howl. My fingers claw your skin, try to tear my way in. You are the moon at night for which I have to... Howl, howl, howl, howl. Now there's no holding back, I'm making to attack. My blood is singing with your voice, I want to pour it out. The saints can't help me now, the ropes have been unbound. I hunt for you with bloody feet across the hallowed ground. Like some child, possessed, the beast howls in my veins. I want to find you, tear out all your tenderness. Howl, howl, howl, howl. Be careful of the curse that falls on young lovers. Starts so soft and sweet and turns them to hunters. The fabric of your flesh, pure as a wedding dress. Until I wrap myself inside your arms I cannot rest. The saints can't help me now, the ropes have been unbound. I hunt for you with bloody feet across the hallowed ground and howl... Be careful of the curse that falls on young lovers. Starts so soft and sweet and turns them to hunters. A man who's pure of heart and says his prayers by night may still become a wolf when the autumn moon is bright. If you could only see the beast you've made of me. I held it in but now it seems you've set it running free. The saints can't help me now, the ropes have been unbound. I hunt for you with bloody feet across the hallowed ground.",2009,Howl,Florence + The Machine,0,0,0,0,0,0,0,0,0,0,0,0,0,0,0,0,0,0,0,0,0,0,0,0,0,0,0,1,0,0,0,0,0,0,0,0,0,1,375,0.9333333333333333,1.0,26,0,0,121.22,102.31,2.4000000000000004,7.785822784810127,-2.2,3.3
